{
    "$schema": "http://json-schema.org/draft-07/schema",
    "required": [
        "formatType",
        "formatVersion"
    ],
    "properties": {
        "formatType": {
            "const": "omf:version"
        },
        "formatVersion": {
            "const": 0
        },
        "meta": {
            "$ref": "meta.schema.json#/definitions/combinedMeta"
        },
        "files": {
            "type": "array",
            "description": "Files in this Version",
            "items": {
                "type": "object",
                "required": [
                    "fileType",
                    "downloads",
                    "hashes",
                    "fileSize"
                ],
                "properties": {
                    "primary": {
                        "type": "boolean"
                    },
                    "downloads": {
                        "type": "array",
                        "description": "URLs where this file can be downloaded",
                        "items": {
                            "type": "string",
                            "format": "uri"
                        },
                        "minItems": 1
                    },
                    "hashes": {
                        "$ref": "meta.schema.json#/definitions/hashes"
                    },
                    "fileSize": {
                        "$ref": "meta.schema.json#/definitions/fileSize"
                    }
                },
                "oneOf": [
                    {
                        "properties": {
                            "fileType": {
                                "const": "raw"
                            },
                            "fileName": {
                                "type": "string",
                                "description": "Name of this file"
                            }
                        }
                    },
                    {
                        "properties": {
                            "fileType": {
                                "const": "jarmod"
                            }
                        }
                    },
                    {
                        "properties": {
                            "fileType": {
                                "const": "versionJson"
                            }
                        }
                    },
                    {
                        "properties": {
                            "fileType": {
                                "const": "omfPack"
                            }
                        }
                    }
                ]
            }
        }
    }
}